Document Title,Abstract,Year,PDF Link,label,doi,nCites,authorCount,aggregationType
"Hippocampal Damage and Exploratory Preferences in Rats: Memory for Objects, Places, and Contexts","Rats have a natural tendency to spend more time exploring novel objects than familiar objects, and this preference can be used as an index of object recognition. Rats also show an exploratory preference for objects in locations where they have not previously encountered objects (an index of place memory) and for familiar objects in contexts different from those in which the objects were originally encountered (an index of context memory). In this experiment, rats with cytotoxic lesions of the hippocampal formation were tested on all three versions of the novelty-preference paradigm, with a 5-min retention interval between the familiarization and test phases. Rats with sham lesions displayed a novelty preference on all three trial types, whereas the rats with hippocampal lesions displayed a novelty preference on Object trials but did not discriminate between the objects on Place trials or Context trials. The findings indicate that hippocampal damage impairs memory for contextual or spatial aspects of an experience, whereas memory for objects that were part of the same experience are left relatively intact.",2002,https://doi.org/10.1101/lm.41302,no,10.1101/lm.41302,575,5,undetermined
Decreased bursting and novel object-specific cell firing in the hippocampus after mild traumatic brain injury,N/A,2014,https://doi.org/10.1016/j.brainres.2014.07.036,no,10.1016/j.brainres.2014.07.036,27,4,undetermined
Genetic Up-Regulation or Pharmacological Activation of the Na+/Ca2+ Exchanger 1 (NCX1) Enhances Hippocampal-Dependent Contextual and Spatial Learning and Memory,N/A,2020,https://doi.org/10.1007/s12035-020-01888-4,no,10.1007/s12035-020-01888-4,14,19,undetermined
Stress and risk avoidance by exploring rats: Implications for stress management in fear-related behaviours,N/A,2013,https://doi.org/10.1016/j.beproc.2012.12.005,no,10.1016/j.beproc.2012.12.005,13,3,undetermined
Cellular tagging as a neural network mechanism for behavioural tagging,"AbstractBehavioural tagging is the transformation of a short-term memory, induced by a weak experience, into a long-term memory (LTM) due to the temporal association with a novel experience. The mechanism by which neuronal ensembles, each carrying a memory engram of one of the experiences, interact to achieve behavioural tagging is unknown. Here we show that retrieval of a LTM formed by behavioural tagging of a weak experience depends on the degree of overlap with the neuronal ensemble corresponding to a novel experience. The numbers of neurons activated by weak training in a novel object recognition (NOR) task and by a novel context exploration (NCE) task, denoted as overlapping neurons, increases in the hippocampal CA1 when behavioural tagging is successfully achieved. Optical silencing of an NCE-related ensemble suppresses NOR–LTM retrieval. Thus, a population of cells recruited by NOR is tagged and then preferentially incorporated into the memory trace for NCE to achieve behavioural tagging.",2016,https://doi.org/10.1038/ncomms12319,no,10.1038/ncomms12319,86,12,undetermined
Enhanced context-dependency of object recognition in rats with hippocampal lesions,N/A,2006,https://doi.org/10.1016/j.bbr.2006.02.008,no,10.1016/j.bbr.2006.02.008,47,4,undetermined
Long-term multi-species Lactobacillus and Bifidobacterium dietary supplement enhances memory and changes regional brain metabolites in middle-aged rats,N/A,2017,https://doi.org/10.1016/j.nlm.2017.05.015,no,10.1016/j.nlm.2017.05.015,89,6,undetermined
Neuropeptide S Enhances Memory During the Consolidation Phase and Interacts with Noradrenergic Systems in the Brain,N/A,2011,https://doi.org/10.1038/npp.2010.207,no,10.1038/npp.2010.207,109,7,undetermined
Glucocorticoid effects on object recognition memory require training-associated emotional arousal,"Considerable evidence implicates glucocorticoid hormones in the regulation of memory consolidation and memory retrieval. The present experiments investigated whether the influence of these hormones on memory depends on the level of emotional arousal induced by the training experience. We investigated this issue in male Sprague–Dawley rats by examining the effects of immediate posttraining systemic injections of the glucocorticoid corticosterone on object recognition memory under two conditions that differed in their training-associated emotional arousal. In rats that were not previously habituated to the experimental context, corticosterone (0.3, 1.0, or 3.0 mg/kg, s.c.) administered immediately after a 3-min training trial enhanced 24-hr retention performance in an inverted-U shaped dose–response relationship. In contrast, corticosterone did not affect 24-hr retention of rats that received extensive prior habituation to the experimental context and, thus, had decreased novelty-induced emotional arousal during training. Additionally, immediate posttraining administration of corticosterone to nonhabituated rats, in doses that enhanced 24-hr retention, impaired object recognition performance at a 1-hr retention interval whereas corticosterone administered after training to well-habituated rats did not impair 1-hr retention. Thus, the present findings suggest that training-induced emotional arousal may be essential for glucocorticoid effects on object recognition memory.",2004,https://doi.org/10.1073/pnas.0307803100,no,10.1073/pnas.0307803100,319,3,undetermined
Post-training reversible inactivation of the hippocampus enhances novel object recognition memory,"Research on the role of the hippocampus in object recognition memory has produced conflicting results. Previous studies have used permanent hippocampal lesions to assess the requirement for the hippocampus in the object recognition task. However, permanent hippocampal lesions may impact performance through effects on processes besides memory consolidation including acquisition, retrieval, and performance. To overcome this limitation, we used an intrahippocampal injection of the GABA agonist muscimol to reversibly inactivate the hippocampus immediately after training mice in two versions of an object recognition task. We found that the inactivation of the dorsal hippocampus after training impairs object-place recognition memory but enhances novel object recognition (NOR) memory. However, inactivation of the dorsal hippocampus after repeated exposure to the training context did not affect object recognition memory. Our findings suggest that object recognition memory formation does not require the hippocampus and, moreover, that activity in the hippocampus can interfere with the consolidation of object recognition memory when object information encoding occurs in an unfamiliar environment.",2010,https://doi.org/10.1101/lm.1625310,no,10.1101/lm.1625310,191,4,undetermined
Conceptual coherence affects phonological activation of context objects during object naming.,N/A,2008,https://doi.org/10.1037/0278-7393.34.3.587,no,10.1037/0278-7393.34.3.587,17,3,undetermined
Role of slow oscillatory activity and slow wave sleep in consolidation of episodic-like memory in rats,N/A,2014,https://doi.org/10.1016/j.bbr.2014.09.008,no,10.1016/j.bbr.2014.09.008,39,6,undetermined
Sleep deprivation and daily torpor impair object recognition in Djungarian hamsters,N/A,2006,https://doi.org/10.1016/j.physbeh.2005.09.005,no,10.1016/j.physbeh.2005.09.005,29,4,undetermined
Rats Remember Items in Context Using Episodic Memory,N/A,2016,https://doi.org/10.1016/j.cub.2016.08.023,no,10.1016/j.cub.2016.08.023,81,8,undetermined
Interactions between stimulus and response types are more strongly represented in the entorhinal cortex than in its upstream regions in rats,"Previously we reported results which suggested that response types are critical in dissociating the lateral entorhinal cortex (LEC) from the medial entorhinal cortex (MEC) in a scene memory task (&lt;xref ref-type=""bibr"" rid=""bib26""&gt;Yoo and Lee, 2017&lt;/xref&gt;). Here, we investigated whether the perirhinal cortex (PER) and postrhinal cortex (POR), the upstream regions of the LEC and MEC, respectively, could be dissociated similarly. We conducted four tasks by combining different stimulus and response types. Our results suggest that the PER is important whenever object recognition is required and, together with prior findings, imply that PER-LEC networks are essential in goal-directed interactions with objects. The POR appears critical for recognizing visual scenes and may play key roles in scene-based navigation together with the MEC. The relative lack of functional dissociation between stimulus and response types at the PER-POR level suggests that actions conditioned on the recognition of external stimuli may be uniquely represented from the EC.",2017,https://doi.org/10.7554/elife.32657,no,10.7554/elife.32657,12,3,undetermined
Erythropoietin protects newborn rat against sevoflurane‐induced neurotoxicity,"SummaryIntroductionRecent data on newborn animals exposed to anesthetics have raised safety concerns regarding anesthesia practices in young children. Indeed, studies on rodents have demonstrated a widespread increase in brain apoptosis shortly after exposure to sevoflurane, followed by long‐term neurologic impairment. In this context, we aimed to evaluate the protective effect of rh‐EPO, a potent neuroprotective agent, in rat pups exposed to sevoflurane.Material and MethodsAt postnatal day 7, 75 rat pups were allocated into three groups: SEVO + EPO (n = 27) exposed to sevoflurane 2 vol% (0.5 MAC) for 6 h in an air/O2 mixture (60/40) + 5000 UI.kg−1rh‐EPO IP; SEVO (n = 27) exposed to sevoflurane + vehicle IP; and CONTROL (n = 21) exposed to the mixture without sevoflurane + vehicle IP. Three days after anesthesia (D10), apoptosis was quantified on brain extract with TUNEL method and caspase 3. NGF and BDNF expression was determined by Western blotting. Rats reaching adulthood were evaluated in terms of exploration capacities (object exploration duration) together with spatial and object learning (water maze and novel object test).ResultsSevoflurane exposure impaired normal behavior in adult rats by reducing the exploratory capacities during the novel object test and impaired both spatial and object learning capacities in adult rats (water maze, ratio time to find platform 3rd trial/1st trial: 1.1 ± 0.2 vs 0.4 ± 0.1; n = 9, SEVO vs CONTROL; P = 0.01). Rh‐EPO reduced sevoflurane‐induced behavior and learning abnormalities in adult rats (water maze, ratio time to find platform 3rd trial/1st trial: 0.3 ± 0.1 vs 1.1 ± 0.2; n = 9, SEVO + EPO vs SEVO; P = 0.01). Three days after anesthesia, rh‐EPO prevented sevoflurane‐induced brain apoptosis (5 ± 3 vs 35 ± 6 apoptotic cells·mm−2; n = 6, SEVO + EPO vs SEVO; P = 0.01) and elevation of caspase three level and significantly increased the brain expression of BDNF and NGF (n = 6, SEVO + EPO vs SEVO; P = 0.01).ConclusionSix hours of sevoflurane anesthesia in newborn rats induces significant long‐term cognitive impairment. A single administration of rh‐EPO immediately after postnatal exposure to sevoflurane reduces both early activation of apoptotic phenomenon and late onset of neurologic disorders.",2014,https://doi.org/10.1111/pan.12372,no,10.1111/pan.12372,43,7,undetermined
Long-lasting memory abnormalities following exposure to the mouse defense test battery: An animal model of PTSD,N/A,2015,https://doi.org/10.1016/j.physbeh.2015.03.039,no,10.1016/j.physbeh.2015.03.039,4,3,undetermined
"The CRF1 receptor antagonist SSR125543 attenuates long-term cognitive deficit induced by acute inescapable stress in mice, independently from the hypothalamic pituitary adrenal axis",N/A,2012,https://doi.org/10.1016/j.pbb.2012.05.013,no,10.1016/j.pbb.2012.05.013,19,5,undetermined
Engram Cell Excitability State Determines the Efficacy of Memory Retrieval,N/A,2019,https://doi.org/10.1016/j.neuron.2018.11.029,no,10.1016/j.neuron.2018.11.029,225,7,undetermined
Early life stress determines the effects of glucocorticoids and stress on hippocampal function: Electrophysiological and behavioral evidence respectively,N/A,2018,https://doi.org/10.1016/j.neuropharm.2018.02.001,no,10.1016/j.neuropharm.2018.02.001,43,8,undetermined
A limited role for the hippocampus in the modulation of novel-object preference by contextual cues,"Recent evidence suggests that rats require an intact hippocampus in order to recognize familiar objects when they encounter them again in a different context. The two experiments reported here further examined how changes in context affect rats' performance on the novel-object preference (NOP) test of object-recognition memory, and how those effects interact with the effects of HPC damage. Rats with HPC lesions and control rats received NOP testing in either the same context in which they had previously encountered sample objects, or in a different but equally familiar context. In Experiment 1, the two contexts had very few overlapping cues within or outside the apparatus; thus, the differences between them were global. Consistent with previous results, control rats showed a novel-object preference in both the unchanged and (globally) changed contexts, whereas rats with HPC lesions displayed a preference only in the unchanged context. In Experiment 2, the context shift included only local features proximal to the test objects. The main results were the reverse of Experiment 1—rats with HPC lesions displayed a novel-object preference in both the unchanged and (locally) changed contexts, whereas control rats displayed a preference only in the unchanged context. The findings are consistent with the view that HPC damage does not cause a general inability to recognize objects, nor an inability to encode or store a representation of the context in which the objects are encountered. They suggest instead that HPC damage impairs the ability to remember specific locations of familiar objects within a particular context.",2008,https://doi.org/10.1101/lm.1035508,no,10.1101/lm.1035508,53,5,undetermined
The GABAB receptor and recognition memory: possible modulation of its behavioral effects by the nitrergic system,N/A,2003,https://doi.org/10.1016/s0306-4522(03)00067-8,no,10.1016/s0306-4522(03)00067-8,42,4,undetermined
Reversible Inhibition of CREB/ATF Transcription Factors in Region CA1 of the Dorsal Hippocampus Disrupts Hippocampus-Dependent Spatial Memory,N/A,2002,https://doi.org/10.1016/s0896-6273(02)00684-0,no,10.1016/s0896-6273(02)00684-0,381,7,undetermined
"Different attentional dysfunctions in <i>eEF2K</i><sup><i>−/−</i></sup><i>, IL1RAPL1</i><sup><i>−/−</i></sup> and <i>SHANK3Δ11</i><sup><i>−/−</i></sup> mice","A common feature of several psychiatric disorders is the attentional impairment. eEF2K
−/−, IL1RAPL1
−/− and SHANK3Δ11
−/− mice were used as animal models consistently linked to changes in synaptic plasticity, learning and memory. All knockout (KO) mice and their corresponding littermates were submitted to the novel object recognition (NOR) and visual object recognition (VOR) tasks. In the NOR, eEF2K−/− mice exhibited a normal performance in terms of mean discrimination index, while SHANK3Δ11−/− and IL1RAPL1
−/− mice were impaired when a delay of 2 and 24 hours was introduced. Surprisingly, when submitted to VOR, where the two objects were replaced with two shapes delivered from two iPods, all the mutant mice performed worse than those in the NOR. In VOR, the application of motion to different shapes, to increase attention, improved performance in eEF2K −/− and IL1RAPL1
−/− but not in SHANK3Δ11
−/− mice. In SHANK3Δ11
−/− mice, attentional deficit was also present even if different motions were applied to the same shapes or when these mice were repeatedly exposed for 5 days to the context. Behavioral analysis showed that eEF2K−/− and IL1RAPL1
−/− mice had a good flexibility tested in the T‐maze. eEF2K−/− showed normal self‐grooming. On the basis of previous literature data indicating that SHANK3Δ11
−/− showed impaired flexibility and reduced sociability, we identified in this genotype the most exhaustive model showing all the core symptoms of autism spectrum disorder including a heavy visual attention deficit. These findings show the importance of VOR to identify mouse models of autism.",2019,https://doi.org/10.1111/gbb.12563,no,10.1111/gbb.12563,10,5,undetermined
Spontaneous object recognition memory is maintained following transformation of global geometric properties.,N/A,2013,https://doi.org/10.1037/a0030698,no,10.1037/a0030698,4,4,undetermined
A reduction in hippocampal GABA<sub>A</sub> receptor α5 subunits disrupts the memory for location of objects in mice,"The memory for location of objects, which binds information about objects to discrete positions or spatial contexts of occurrence, is a form of episodic memory particularly sensitive to hippocampal damage. Its early decline is symptomatic for elderly dementia. Substances that selectively reduce α5‐GABAA receptor function are currently developed as potential cognition enhancers for Alzheimer's syndrome and other dementia, consistent with genetic studies implicating these receptors that are highly expressed in hippocampus in learning performance. Here we explored the consequences of reduced GABAAα5‐subunit contents, as occurring in α5(H105R) knock‐in mice, on the memory for location of objects. This required the behavioral characterization of α5(H105R) and wild‐type animals in various tasks examining learning and memory retrieval strategies for objects, locations, contexts and their combinations. In mutants, decreased amounts of α5‐subunits and retained long‐term potentiation in hippocampus were confirmed. They exhibited hyperactivity with conserved circadian rhythm in familiar actimeters, and normal exploration and emotional reactivity in novel places, allocentric spatial guidance, and motor pattern learning acquisition, inhibition and flexibility in T‐ and eight‐arm mazes. Processing of object, position and context memories and object‐guided response learning were spared. Genotype difference in object‐in‐place memory retrieval and in encoding and response learning strategies for object–location combinations manifested as a bias favoring object‐based recognition and guidance strategies over spatial processing of objects in the mutants. These findings identify in α5(H105R) mice a behavioral–cognitive phenotype affecting basal locomotion and the memory for location of objects indicative of hippocampal dysfunction resulting from moderately decreased α5‐subunit contents.",2010,https://doi.org/10.1111/j.1601-183x.2010.00575.x,no,10.1111/j.1601-183x.2010.00575.x,44,6,undetermined
Memory deficit in Swiss mice exposed to tannery effluent,N/A,2016,https://doi.org/10.1016/j.ntt.2016.03.007,no,10.1016/j.ntt.2016.03.007,30,10,undetermined
Effect of hydroalcoholic <i>Echium amoenum</i> extract on scopolamine-induced learning and memory impairment in rats,N/A,2018,https://doi.org/10.1080/13880209.2018.1543330,no,10.1080/13880209.2018.1543330,19,2,undetermined
The neurosteroid allopregnanolone impairs object memory and contextual fear memory in male C57BL/6J mice,N/A,2014,https://doi.org/10.1016/j.yhbeh.2014.05.005,no,10.1016/j.yhbeh.2014.05.005,32,4,undetermined
Age dependent neuroprotective effects of medhya rasayana prepared from Clitoria ternatea Linn. in stress induced rat brain,N/A,2017,https://doi.org/10.1016/j.jep.2016.07.068,no,10.1016/j.jep.2016.07.068,27,8,undetermined
A model of hippocampal spiking responses to items during learning of a context-dependent task,N/A,2014,https://doi.org/10.3389/fnsys.2014.00178,no,10.3389/fnsys.2014.00178,13,2,undetermined
"Impact of adolescent sucrose access on cognitive control, recognition memory, and parvalbumin immunoreactivity","In this study we sought to determine the effect of daily sucrose consumption in young rats on their subsequent performance in tasks that involve the prefrontal cortex and hippocampus. High levels of sugar consumption have been associated with the development of obesity, however less is known about how sugar consumption influences behavioral control and high-order cognitive processes. Of particular concern is the fact that sugar intake is greatest in adolescence, an important neurodevelopmental period. We provided sucrose to rats when they were progressing through puberty and adolescence. Cognitive performance was assessed in adulthood on a task related to executive function, a rodent analog of the Stroop task. We found that sucrose-exposed rats failed to show context-appropriate responding during incongruent stimulus compounds presented at test, indicative of impairments in prefrontal cortex function. Sucrose exposed rats also showed deficits in an on object-in-place recognition memory task, indicating that both prefrontal and hippocampal function was impaired. Analysis of brains showed a reduction in expression of parvalbumin-immunoreactive GABAergic interneurons in the hippocampus and prefrontal cortex, indicating that sucrose consumption during adolescence induced long-term pathology, potentially underpinning the cognitive deficits observed. These results suggest that consumption of high levels of sugar-sweetened beverages by adolescents may also impair neurocognitive functions affecting decision-making and memory, potentially rendering them at risk for developing mental health disorders.",2015,https://doi.org/10.1101/lm.038000.114,no,10.1101/lm.038000.114,103,5,undetermined
New automated procedure to assess context recognition memory in mice,N/A,2014,https://doi.org/10.1007/s00213-014-3577-3,no,10.1007/s00213-014-3577-3,7,5,undetermined
Stress Facilitates the Development of Cognitive Dysfunction After Chronic Ethanol Exposure,N/A,2017,https://doi.org/10.1111/acer.13444,no,10.1111/acer.13444,37,6,undetermined
"Exploration, fear and maze learning in spontaneously hypertensive and normotensive rats",N/A,1988,https://doi.org/10.1016/s0163-1047(88)90528-6,no,10.1016/s0163-1047(88)90528-6,19,3,undetermined
<i>Thunbergia laurifolia</i>extract ameliorates cognitive and emotional deficits in olfactorectomized mice,N/A,2015,https://doi.org/10.3109/13880209.2014.962059,no,10.3109/13880209.2014.962059,5,5,undetermined
"Pattern separation, completion, and categorisation in the hippocampus and neocortex",N/A,2016,https://doi.org/10.1016/j.nlm.2015.07.008,no,10.1016/j.nlm.2015.07.008,210,1,undetermined
Glucocorticoid enhancement of memory requires arousal-induced noradrenergic activation in the basolateral amygdala,"Considerable evidence indicates that glucocorticoid hormones enhance the consolidation of long-term memories for emotionally arousing experiences but not that for less arousing or neutral information. However, previous studies have not determined the basis of such arousal-induced selectivity. Here we report the finding that endogenous noradrenergic activation of the basolateral complex of the amygdala (BLA) induced by emotional arousal is essential in enabling glucocorticoid memory enhancement. Corticosterone administered immediately after object recognition training enhanced 24-h memory of naïve male rats but not that of rats previously habituated to the training context in order to reduce novelty-induced emotional arousal. The β-adrenoceptor antagonist propranolol administered either systemically or into the BLA blocked the corticosterone-induced memory enhancement. Further, in habituated rats, corticosterone activated BLA neurons, as assessed by phosphorylated cAMP response element binding (pCREB) immunoreactivity levels, and enhanced memory only when norepinephrine release was stimulated by administration of the α
            2
            -adrenoceptor antagonist yohimbine. These findings strongly suggest that synergistic actions of glucocorticoids and emotional arousal-induced noradrenergic activation of the BLA constitute a neural mechanism by which glucocorticoids may selectively enhance memory consolidation for emotionally arousing experiences.",2006,https://doi.org/10.1073/pnas.0601874103,no,10.1073/pnas.0601874103,401,4,undetermined
Effects of dorsal hippocampus catecholamine depletion on paired-associates learning and place learning in rats,N/A,2017,https://doi.org/10.1016/j.bbr.2017.01.038,no,10.1016/j.bbr.2017.01.038,3,2,undetermined
An isoform-selective p38α mitogen-activated protein kinase inhibitor rescues early entorhinal cortex dysfunctions in a mouse model of Alzheimer's disease,N/A,2018,https://doi.org/10.1016/j.neurobiolaging.2018.06.006,no,10.1016/j.neurobiolaging.2018.06.006,32,5,undetermined
Cocaine Paired Environment Increases SATB2 Levels in the Rat Paraventricular Thalamus,N/A,2018,https://doi.org/10.3389/fnbeh.2018.00224,no,10.3389/fnbeh.2018.00224,8,6,undetermined
