Document Title,Abstract,Year,PDF Link,label,doi,nCites,authorCount,aggregationType
Determinants of object‐in‐context and object‐place‐context recognition in the developing rat,"AbstractSince the seminal report on novel object recognition in the rat (Ennaceur &amp; Delacour, 1988), novelty recognition paradigms have become increasingly prevalent in learning and memory research. Novelty recognition tasks do not require extensive training or complex behaviors, and thus are especially suitable for studying the ontogeny of various forms of memory (e.g., object, spatial, and contextual memory). However, relatively little is known about the determinants of recognition memory during development. The present study extends our recent research on the development of recognition memory by further characterizing the ontogeny of contextual recognition (Ramsaran, Westbrook, &amp; Stanton, 2016). We report that long‐term retention of object‐in‐context (OiC) memory emerges during early development in the rat (Experiment 1), and that performance of object‐place‐context (OPC), a spatial variant of the OiC task, also displays protracted development until early adolescence (Experiment 2). In addition, we examined the role of NMDA receptors (NMDARs) in contextual recognition and found that OiC memory is not dependent on NMDAR‐mediated plasticity whereas performance of spatial task variants including the distal cue OiC (Ramsaran et al., 2016) and OPC tasks are NMDAR‐dependent (Experiments 3 and 4). The ontogeny of contextual recognition is influenced by memory retention and spatial processing demands, which may also determine the neurobiological mechanisms supporting task performance.",2016,https://doi.org/10.1002/dev.21432,no,10.1002/dev.21432,25,3,undetermined
Ontogeny of object-in-context recognition in the rat,N/A,2016,https://doi.org/10.1016/j.bbr.2015.04.011,no,10.1016/j.bbr.2015.04.011,34,3,undetermined
Relative recency influences object-in-context memory,N/A,2015,https://doi.org/10.1016/j.bbr.2014.12.024,no,10.1016/j.bbr.2014.12.024,11,3,undetermined
Blockade of hippocampal bradykinin B1 receptors improves spatial learning and memory deficits in middle-aged rats,N/A,2017,https://doi.org/10.1016/j.bbr.2016.08.041,no,10.1016/j.bbr.2016.08.041,14,10,undetermined
"Dentate gyrus supports slope recognition memory, shades of grey-context pattern separation and recognition memory, and CA3 supports pattern completion for object memory",N/A,2016,https://doi.org/10.1016/j.nlm.2015.08.010,no,10.1016/j.nlm.2015.08.010,33,5,undetermined
Recognition memory is selectively impaired in adult rats exposed to binge-like doses of ethanol during early postnatal life,N/A,2016,https://doi.org/10.1016/j.alcohol.2016.09.027,no,10.1016/j.alcohol.2016.09.027,14,5,undetermined
Co-morbid beta-amyloid toxicity and stroke produce impairments in an ambiguous context task in rats without any impairment in spatial working memory,N/A,2015,https://doi.org/10.1016/j.nlm.2015.01.001,no,10.1016/j.nlm.2015.01.001,5,4,undetermined
Sleep enhances inhibitory behavioral control in discrimination learning in rats,N/A,2014,https://doi.org/10.1007/s00221-013-3797-5,no,10.1007/s00221-013-3797-5,11,5,undetermined
Evidence of a role for orbital prefrontal cortex in preventing over-generalization to moderate predictors of biologically significant events,N/A,2017,https://doi.org/10.1016/j.neuroscience.2016.10.017,no,10.1016/j.neuroscience.2016.10.017,13,6,undetermined
Disconnection of the Perirhinal and Postrhinal Cortices Impairs Recognition of Objects in Context But Not Contextual Fear Conditioning,"The perirhinal cortex (PER) is known to process object information, whereas the rodent postrhinal cortex (POR), homolog to the parahippocampal cortex in primates, is thought to process spatial information. A number of studies, however, provide evidence that both areas are involved in processing contextual information. In this study, we tested the hypothesis that the rat POR relies on object information received from the PER to form complex representations of context. Using three fear-conditioning (FC) paradigms (signaled, unsignaled, and renewal) and two context-guided object recognition tasks (with 3D and 2D objects), we examined the effects of crossed excitotoxic lesions to the POR and the contralateral PER. Performance of rats with crossed lesions was compared with that of rats with ipsilateral POR plus PER lesions and sham-operated rats. We found that rats with contralateral PER–POR lesions were impaired in object–context recognition but not in contextual FC. Therefore, interaction between the POR and PER is necessary for context-guided exploratory behavior but not for associating fear with context. Our results provide evidence for the hypothesis that the POR relies on object and pattern information from the PER to encode representations of context. The association of fear with a context, however, may be supported by alternate cortical and/or subcortical pathways when PER–POR interaction is not available. Our results suggest that contextual FC may represent a special case of context-guided behavior.SIGNIFICANCE STATEMENTRepresentations of context are important for perception, memory, decision making, and other cognitive processes. Moreover, there is extensive evidence that the use of contextual representations to guide appropriate behavior is disrupted in neuropsychiatric and neurological disorders including developmental disorders, schizophrenia, affective disorders, and Alzheimer's disease. Many of these disorders are accompanied by changes in parahippocampal and hippocampal structures. Understanding how context is represented in the brain and how parahippocampal structures are involved will enhance our understanding and treatment of the cognitive and behavioral symptoms associated with neurological disorders and neuropsychiatric disease.",2017,https://doi.org/10.1523/jneurosci.0254-17.2017,no,10.1523/jneurosci.0254-17.2017,30,5,undetermined
Retroactive interference of object‐in‐context long‐term memory: Role of dorsal hippocampus and medial prefrontal cortex,"ABSTRACTRetroactive interference (RI) is a type of amnesia in which a new learning experience can impair the expression of a previous one. It has been studied in several types of memories for over a century. Here, we aimed to study in the long‐term memory (LTM) formation of an object‐in‐context task, defined as the recognition of a familiar object in a context different to that in which it was previously encountered. We trained rats with two sample trials, each taking place in a different context in association with different objects. Test sessions were performed 24 h later, to evaluate LTM for both object‐context pairs using separate groups of trained rats. Furthermore, given the involvement of hippocampus (Hp) and medial prefrontal cortex (mPFC) in several recognition memories, we also analyzed the participation of these structures in the LTM formation of this task by the local infusion of muscimol. Our results show that object‐in‐context LTM formation is sensitive to RI by a different either familiar or novel object‐context pair trial, experienced 1 h later. This interference occurs in a restricted temporal window and works on the LTM consolidation phase, leaving intact short‐term memory expression. The second sample trial did not affect the object recognition part of the memory. Besides, muscimol treatment before the second sample trial blocks its object‐in‐context LTM and restores the first sample trial memory. We hypothesized that LTM‐RI amnesia is probably caused by resources or cellular machinery competition in these brain regions when they are engaged in memory formation of the traces. In sum, when two different object‐in‐context memory traces are being processed, the second trace interferes with the consolidation of the first one requiring mPFC and CA1 dorsal Hp activation. © 2014 Wiley Periodicals, Inc.",2014,https://doi.org/10.1002/hipo.22328,no,10.1002/hipo.22328,55,4,undetermined
"Systemic lipopolysaccharide administration impairs retrieval of context–object discrimination, but not spatial, memory: Evidence for selective disruption of specific hippocampus-dependent memory functions during acute neuroinflammation",N/A,2015,https://doi.org/10.1016/j.bbi.2014.09.014,no,10.1016/j.bbi.2014.09.014,121,4,undetermined
Early Exposure to Volatile Anesthetics Impairs Long-Term Associative Learning and Recognition Memory,N/A,2014,https://doi.org/10.1371/journal.pone.0105340,no,10.1371/journal.pone.0105340,44,5,undetermined
Cisplatin-induced mitochondrial dysfunction is associated with impaired cognitive function in rats,N/A,2017,https://doi.org/10.1016/j.freeradbiomed.2016.11.046,no,10.1016/j.freeradbiomed.2016.11.046,144,5,undetermined
Prenatal and early life exposure to air pollution induced hippocampal vascular leakage and impaired neurogenesis in association with behavioral deficits,"AbstractExposure to traffic-related air pollution (TRAP) is associated with a range of neurodevelopmental disorders in human populations. In rodent models, prenatal TRAP exposure increased depressive behaviors and increased brain microglial activity. To identify cellular mechanisms, we examined adult neurogenesis and the blood–brain barrier (BBB) in relation to cognition and motivated behaviors in rats that were exposed to a nano-sized TRAP subfraction from gestation into adulthood. At age 5 months, exposed male rats had 70% fewer newly generated neurons in the dentate gyrus (DG) of the hippocampus. Microglia were activated in DG and CA1 subfields (35% more Iba1). The BBB was altered, with a 75% decrease of the tight junction protein ZO-1 in the CA1 layer, and twofold more iron deposits, a marker of microhemorrhages. The exposed rats had impaired contextual memory (novel object in context), reduced food-seeking behavior, and increased depressive behaviors (forced swim). Deficits of de novo neurogenesis were inversely correlated with depressive behavior, whereas increased microbleeds were inversely correlated with deficits in contextual memory. These findings give the first evidence that prenatal and early life exposure to TRAP impairs adult hippocampal neurogenesis and increases microbleeds in association with behavioral deficits.",2018,https://doi.org/10.1038/s41398-018-0317-1,no,10.1038/s41398-018-0317-1,104,9,undetermined
The role of the dorsal dentate gyrus in object and object-context recognition,N/A,2013,https://doi.org/10.1016/j.nlm.2013.07.013,no,10.1016/j.nlm.2013.07.013,40,2,undetermined
The importance of the context in the hippocampus and brain related areas throughout the performance of a fear conditioning task,"ABSTRACTThe importance context has been broadly studied in the management of phobias and in the drug addiction literature. The way in which changes to a context influence behavior after the simple acquisition of a passive avoidance task remains unclear. The hippocampus has long been implicated in the contextual and spatial processing required for contextual fear, but its role in encoding the aversive component of a contextual fear memory is still inconclusive. Our work tries to elucidate whether a change in context, represented as differences in the load of the stimuli, is critical for learning about the context‐shock association and whether this manipulation of the context could be linked to any change in metabolic brain activity requirements. For this purpose, we used an avoidance conditioning task. Animals were divided into three different experimental conditions. In one group, acquisition was performed in an enriched stimuli environment and retention was performed in a typically lit chamber (the PA‐ACQ‐CONTX group). In another group, acquisition was performed in the typically lit chamber and retention was undertaken in the highly enriched chamber (the PA‐RET‐CONTX group). Finally, for the control group, PA‐CN‐CONTX, acquisition, and retention were performed in the enriched stimuli environment. Our results showed that the PA‐ACQ‐CONTX group had longer escape latencies and poorer retention than the PA‐RET‐CONTX and PA‐CN‐CONTX groups after 24 h of acquisition under contextual changes. To study metabolic brain activity, histochemical labelling of cytochrome c‐oxidase (CO) was performed. CO results suggested a neural circuit including the hippocampus, amygdala, thalamus, parahippocampal cortices, and mammillary nuclei that is involved in the learning and memory processes that enable context‐dependent behavior. These results highlight how dysfunction in this network may be involved in the contextualization of fear associations that underlie several forms of psychopathology, including post‐traumatic stress disorder, schizophrenia, and substance abuse disorders. © 2015 Wiley Periodicals, Inc.",2015,https://doi.org/10.1002/hipo.22430,no,10.1002/hipo.22430,17,3,undetermined
Early-life sugar consumption has long-term negative effects on memory function in male rats,N/A,2019,https://doi.org/10.1080/1028415x.2017.1378851,no,10.1080/1028415x.2017.1378851,61,4,undetermined
Long-term effects of neonatal exposure to MK-801 on recognition memory and excitatory–inhibitory balance in rat hippocampus,N/A,2015,https://doi.org/10.1016/j.neuroscience.2015.09.003,no,10.1016/j.neuroscience.2015.09.003,34,6,undetermined
Lateral entorhinal cortex is critical for novel object‐context recognition,"AbstractEpisodic memory incorporates information about specific events or occasions including spatial locations and the contextual features of the environment in which the event took place. It has been modeled in rats using spontaneous exploration of novel configurations of objects, their locations, and the contexts in which they are presented. While we have a detailed understanding of how spatial location is processed in the brain relatively little is known about where the nonspatial contextual components of episodic memory are processed. Initial experiments measured c‐fos expression during an object‐context recognition (OCR) task to examine which networks within the brain process contextual features of an event. Increased c‐fos expression was found in the lateral entorhinal cortex (LEC; a major hippocampal afferent) during OCR relative to control conditions. In a subsequent experiment it was demonstrated that rats with lesions of LEC were unable to recognize object‐context associations yet showed normal object recognition and normal context recognition. These data suggest that contextual features of the environment are integrated with object identity in LEC and demonstrate that recognition of such object‐context associations requires the LEC. This is consistent with the suggestion that contextual features of an event are processed in LEC and that this information is combined with spatial information from medial entorhinal cortex to form episodic memory in the hippocampus. © 2013 Wiley Periodicals, Inc.",2013,https://doi.org/10.1002/hipo.22095,no,10.1002/hipo.22095,216,6,undetermined
Noradrenergic activation of the basolateral amygdala modulates the consolidation of object-in-context recognition memory,N/A,2014,https://doi.org/10.3389/fnbeh.2014.00160,no,10.3389/fnbeh.2014.00160,66,3,undetermined
"Associative recognition and the hippocampus: Differential effects of hippocampal lesions on object‐place, object‐context and object‐place‐context memory","AbstractThe hippocampus is thought to be required for the associative recognition of objects together with the spatial or temporal contexts in which they occur. However, recent data showing that rats with fornix lesions perform as well as controls in an object‐place task, while being impaired on an object‐place‐context task (Eacott and Norman (2004) J Neurosci 24:1948–1953), suggest that not all forms of context‐dependent associative recognition depend on the integrity of the hippocampus. To examine the role of the hippocampus in context‐dependent recognition directly, the present study tested the effects of large, selective, bilateral hippocampus lesions in rats on performance of a series of spontaneous recognition memory tasks: object recognition, object‐place recognition, object‐context recognition and object‐place‐context recognition. Consistent with the effects of fornix lesions, animals with hippocampus lesions were impaired only on the object‐place‐context task. These data confirm that not all forms of context‐dependent associative recognition are mediated by the hippocampus. Subsequent experiments suggested that the object‐place task does not require an allocentric representation of space, which could account for the lack of impairment following hippocampus lesions. Importantly, as the object‐place‐context task has similar spatial requirements, the selective deficit in object‐place‐context recognition suggests that this task requires hippocampus‐dependent neural processes distinct from those required for allocentric spatial memory, or for object memory, object‐place memory or object‐context memory. Two possibilities are that object, place, and context information converge only in the hippocampus, or that recognition of integrated object‐place‐context information requires a hippocampus‐dependent mode of retrieval, such as recollection. © 2009 Wiley‐Liss, Inc.",2010,https://doi.org/10.1002/hipo.20714,no,10.1002/hipo.20714,200,2,undetermined
Episodic-like memory: New perspectives from a behavioral test in rats,N/A,2012,https://doi.org/10.1142/s021963521250001x,no,10.1142/s021963521250001x,4,3,undetermined
"Diet, age, and prior injury status differentially alter behavioral outcomes following concussion in rats",N/A,2015,https://doi.org/10.1016/j.nbd.2014.09.003,no,10.1016/j.nbd.2014.09.003,35,4,undetermined
Role of Medial Prefrontal Cortex Serotonin 2A Receptors in the Control of Retrieval of Recognition Memory in Rats,"Often, retrieval cues are not uniquely related to one specific memory, which could lead to memory interference. Controlling interference is particularly important during episodic memory retrieval or when remembering specific events in a spatiotemporal context. Despite a clear involvement of prefrontal cortex (PFC) in episodic memory in human studies, information regarding the mechanisms and neurotransmitter systems in PFC involved in memory is scarce. Although the serotoninergic system has been linked to PFC functionality and modulation, its role in memory processing is poorly understood. We hypothesized that the serotoninergic system in PFC, in particular the 5-HT2A receptor (5-HT2AR) could have a role in the control of memory retrieval. In this work we used different versions of the object recognition task in rats to study the role of the serotoninergic modulation in the medial PFC (mPFC) in memory retrieval. We found that blockade of 5-HT2AR in mPFC affects retrieval of an object in context memory in a spontaneous novelty preference task, while sparing single-item recognition memory. We also determined that 5-HT2ARs in mPFC are required for hippocampal–mPFC interaction during retrieval of this type of memory, suggesting that the mPFC controls the expression of memory traces stored in the hippocampus biasing retrieval to the most relevant one.",2013,https://doi.org/10.1523/jneurosci.2087-13.2013,no,10.1523/jneurosci.2087-13.2013,63,4,undetermined
Phencyclidine withdrawal disrupts episodic-like memory in rats: reversal by donepezil but not clozapine,N/A,2010,https://doi.org/10.1017/s1461145710000234,no,10.1017/s1461145710000234,16,3,undetermined
Extending the spontaneous preference test of recognition: evidence of object-location and object-context recognition,N/A,1999,https://doi.org/10.1016/s0166-4328(98)00079-5,no,10.1016/s0166-4328(98)00079-5,498,2,undetermined
Pterostilbene Improves Cognitive Performance in Aged Rats: An in Vivo Study,N/A,2019,https://doi.org/10.33594/000000017,no,10.33594/000000017,24,0,undetermined
"Importance of the brain corticosteroid receptor balance in metaplasticity, cognitive performance and neuro-inflammation",N/A,2018,https://doi.org/10.1016/j.yfrne.2018.02.003,no,10.1016/j.yfrne.2018.02.003,208,5,undetermined
The consolidation of object and context recognition memory involve different regions of the temporal lobe,"These experiments investigated the involvement of several temporal lobe regions in consolidation of recognition memory. Anisomycin, a protein synthesis inhibitor, was infused into the hippocampus, perirhinal cortex, insular cortex, or basolateral amygdala of rats immediately after the sample phase of object or object-in-context recognition memory training. Anisomycin infused into perirhinal or insular cortices blocked long-term (24 h), but not short-term (90 min) object recognition memory. Infusions into the hippocampus or amygdala did not impair object recognition memory. Anisomycin infused into the hippocampus blocked long-term, but not short-term object-in-context recognition memory, whereas infusions administered into the perirhinal cortex, insular cortex, or amygdala did not affect object-in-context recognition memory. These results clearly indicate that distinct regions of the temporal lobe are differentially involved in long-term object and object-in-context recognition memory. Whereas perirhinal and insular cortices are required for consolidation of familiar objects, the hippocampus is necessary for consolidation of contextual information of recognition memory. Altogether, these results suggest that temporal lobe structures are differentially involved in recognition memory consolidation.",2008,https://doi.org/10.1101/lm.1028008,no,10.1101/lm.1028008,188,6,undetermined
A new behavioural apparatus to reduce animal numbers in multiple types of spontaneous object recognition paradigms in rats,N/A,2012,https://doi.org/10.1016/j.jneumeth.2012.08.006,no,10.1016/j.jneumeth.2012.08.006,34,3,undetermined
Female rats are more vulnerable to lasting cognitive impairment after isoflurane exposure on postnatal day 4 than 7,N/A,2019,https://doi.org/10.1016/j.bja.2018.12.008,no,10.1016/j.bja.2018.12.008,33,5,undetermined
Auditory-cued sensorimotor task reveals disengagement deficits in rats exposed to the autism-associated teratogen valproic acid,N/A,2014,https://doi.org/10.1016/j.neuroscience.2014.02.049,no,10.1016/j.neuroscience.2014.02.049,9,8,undetermined
Multiple effects of circadian dysfunction induced by photoperiod shifts: Alterations in context memory and food metabolism in the same subjects,N/A,2013,https://doi.org/10.1016/j.physbeh.2013.04.010,no,10.1016/j.physbeh.2013.04.010,30,6,undetermined
A comparison of the effects of temporary hippocampal lesions on single and dual context versions of the olfactory sequence memory task.,N/A,2012,https://doi.org/10.1037/a0028824,no,10.1037/a0028824,5,2,undetermined
Fear-context association during memory retrieval requires input from granular to dysgranular retrosplenial cortex,N/A,2019,https://doi.org/10.1016/j.nlm.2019.107036,no,10.1016/j.nlm.2019.107036,13,4,undetermined
Lesions of the medial or lateral perforant path have different effects on hippocampal contributions to place learning and on fear conditioning to context,N/A,1999,https://doi.org/10.1016/s0166-4328(98)00144-2,no,10.1016/s0166-4328(98)00144-2,78,3,undetermined
Object/context-specific memory deficits associated with loss of hippocampal granule cells after adrenalectomy in rats,"Chronic adrenalectomy (ADX) causes a gradual and selective loss of granule cells in the dentate gyrus (DG) of the rat. Here, we administered replacement corticosterone to rats beginning 10 wk after ADX. We then tested them in three discrimination tasks based on object novelty, location, or object/context association. Only during testing of the object/context association did ADX rats demonstrate deficits. These findings add to a body of evidence that the hippocampus is necessary when contextual information is important. We also confirm that memory deficits after chronic adrenalectomy are not a result of loss of corticosterone per se.",2010,https://doi.org/10.1101/lm.1746710,no,10.1101/lm.1746710,69,2,undetermined
